[
  {
    "id": "a3b-001",
    "name": "Tropius",
    "set_code": "a3b",
    "set_name": "Eevee Grove",
    "pack": "Eevee Grove",
    "release_date": "2025-06-26",
    "type": "Pokémon",
    "subtype": "Grass",
    "stage": "Basic",
    "evolves_from": null,
    "rarity": "◊◊",
    "pack_points": 70,
    "ex": false,
    "mega": false,
    "shiny": false,
    "special_tags": null,
    "art_style": null,
    "health": 100,
    "retreat": 2,
    "weakness": "Fire",
    "ability": {
      "exists": false,
      "name": null,
      "effect": null
    },
    "card_text": null,
    "attacks": {
      "1": {
        "cost": "CCC",
        "name": "Cutting Wind",
        "damage": 60,
        "effect": null
      },
      "2": {
        "cost": null,
        "name": null,
        "damage": null,
        "effect": null
      }
    },
    "points": 1,
    "tradable": true,
    "sharable": true,
    "trade_cost": 0,
    "deckBuilderNr": 797,
    "artist": "Oswaldo KATO",
    "flavour_text": "It lives in tropical jungles. The bunch of fruit around its neck is delicious. The fruit grows twice a year.",
    "alternate_versions": []
  },
  {
    "id": "a3b-002",
    "name": "Leafeon",
    "set_code": "a3b",
    "set_name": "Eevee Grove",
    "pack": "Eevee Grove",
    "release_date": "2025-06-26",
    "type": "Pokémon",
    "subtype": "Grass",
    "stage": "Stage 1",
    "evolves_from": "Eevee",
    "rarity": "◊◊◊",
    "pack_points": 150,
    "ex": false,
    "mega": false,
    "shiny": false,
    "special_tags": null,
    "art_style": null,
    "health": 90,
    "retreat": 1,
    "weakness": "Fire",
    "ability": {
      "exists": false,
      "name": null,
      "effect": null
    },
    "card_text": null,
    "attacks": {
      "1": {
        "cost": "C",
        "name": "Leaf Blast",
        "damage": 10,
        "effect": "This attack does 20 more damage for each [G] Energy attached to this Pokémon."
      },
      "2": {
        "cost": null,
        "name": null,
        "damage": null,
        "effect": null
      }
    },
    "points": 1,
    "tradable": true,
    "sharable": true,
    "trade_cost": 1200,
    "deckBuilderNr": 798,
    "artist": "chibi",
    "flavour_text": "When you see Leafeon asleep in a patch of sunshine, you’ll know it is using photosynthesis to produce clean air.",
    "alternate_versions": [
      {
        "set_code": "a3b",
        "set_name": "Eevee Grove",
        "id": 70,
        "rarity": "☆"
      }
    ]
  },
  {
    "id": "a3b-003",
    "name": "Bounsweet",
    "set_code": "a3b",
    "set_name": "Eevee Grove",
    "pack": "Eevee Grove",
    "release_date": "2025-06-26",
    "type": "Pokémon",
    "subtype": "Grass",
    "stage": "Basic",
    "evolves_from": null,
    "rarity": "◊",
    "pack_points": 35,
    "ex": false,
    "mega": false,
    "shiny": false,
    "special_tags": null,
    "art_style": null,
    "health": 60,
    "retreat": 1,
    "weakness": "Fire",
    "ability": {
      "exists": false,
      "name": null,
      "effect": null
    },
    "card_text": null,
    "attacks": {
      "1": {
        "cost": "C",
        "name": "Flop",
        "damage": 10,
        "effect": null
      },
      "2": {
        "cost": null,
        "name": null,
        "damage": null,
        "effect": null
      }
    },
    "points": 1,
    "tradable": true,
    "sharable": true,
    "trade_cost": 0,
    "deckBuilderNr": 799,
    "artist": "Yuka Morii",
    "flavour_text": "Its sweat is sweet, like syrup made from boiled-down fruit. Because of this, Bounsweet was highly valued in the past, when sweeteners were scarce.",
    "alternate_versions": []
  },
  {
    "id": "a3b-004",
    "name": "Steenee",
    "set_code": "a3b",
    "set_name": "Eevee Grove",
    "pack": "Eevee Grove",
    "release_date": "2025-06-26",
    "type": "Pokémon",
    "subtype": "Grass",
    "stage": "Stage 1",
    "evolves_from": "Bounsweet",
    "rarity": "◊",
    "pack_points": 35,
    "ex": false,
    "mega": false,
    "shiny": false,
    "special_tags": null,
    "art_style": null,
    "health": 80,
    "retreat": 2,
    "weakness": "Fire",
    "ability": {
      "exists": false,
      "name": null,
      "effect": null
    },
    "card_text": null,
    "attacks": {
      "1": {
        "cost": "G",
        "name": "Leaf Step",
        "damage": 40,
        "effect": null
      },
      "2": {
        "cost": null,
        "name": null,
        "damage": null,
        "effect": null
      }
    },
    "points": 1,
    "tradable": true,
    "sharable": true,
    "trade_cost": 0,
    "deckBuilderNr": 800,
    "artist": "Tomokazu Komiya",
    "flavour_text": "Steenee spreads a sweet scent that makes others feel invigorated. This same scent is popular for antiperspirants.",
    "alternate_versions": []
  },
  {
    "id": "a3b-005",
    "name": "Tsareena",
    "set_code": "a3b",
    "set_name": "Eevee Grove",
    "pack": "Eevee Grove",
    "release_date": "2025-06-26",
    "type": "Pokémon",
    "subtype": "Grass",
    "stage": "Stage 2",
    "evolves_from": "Steenee",
    "rarity": "◊◊",
    "pack_points": 70,
    "ex": false,
    "mega": false,
    "shiny": false,
    "special_tags": null,
    "art_style": null,
    "health": 140,
    "retreat": 2,
    "weakness": "Fire",
    "ability": {
      "exists": false,
      "name": null,
      "effect": null
    },
    "card_text": null,
    "attacks": {
      "1": {
        "cost": "G",
        "name": "Kick Down",
        "damage": 50,
        "effect": "Your opponent reveals a random card from their hand and shuffles it into their deck."
      },
      "2": {
        "cost": null,
        "name": null,
        "damage": null,
        "effect": null
      }
    },
    "points": 1,
    "tradable": true,
    "sharable": true,
    "trade_cost": 0,
    "deckBuilderNr": 801,
    "artist": "Naoki Saito",
    "flavour_text": "This Pokémon is proud and aggressive. However, it is said that a Tsareena will instantly become calm if someone touches the crown on its calyx.",
    "alternate_versions": []
  },
  {
    "id": "a3b-006",
    "name": "Applin",
    "set_code": "a3b",
    "set_name": "Eevee Grove",
    "pack": "Eevee Grove",
    "release_date": "2025-06-26",
    "type": "Pokémon",
    "subtype": "Grass",
    "stage": "Basic",
    "evolves_from": null,
    "rarity": "◊",
    "pack_points": 35,
    "ex": false,
    "mega": false,
    "shiny": false,
    "special_tags": null,
    "art_style": null,
    "health": 40,
    "retreat": 1,
    "weakness": "Fire",
    "ability": {
      "exists": false,
      "name": null,
      "effect": null
    },
    "card_text": null,
    "attacks": {
      "1": {
        "cost": "G",
        "name": "Ram",
        "damage": 20,
        "effect": null
      },
      "2": {
        "cost": null,
        "name": null,
        "damage": null,
        "effect": null
      }
    },
    "points": 1,
    "tradable": true,
    "sharable": true,
    "trade_cost": 0,
    "deckBuilderNr": 802,
    "artist": "Kagemaru Himeno",
    "flavour_text": "It grows by eating the flesh of an apple. Applin uses its own body fluid to strengthen the apple’s skin and prevent it from rotting.",
    "alternate_versions": []
  },
  {
    "id": "a3b-007",
    "name": "Appletun",
    "set_code": "a3b",
    "set_name": "Eevee Grove",
    "pack": "Eevee Grove",
    "release_date": "2025-06-26",
    "type": "Pokémon",
    "subtype": "Grass",
    "stage": "Stage 1",
    "evolves_from": "Applin",
    "rarity": "◊◊",
    "pack_points": 70,
    "ex": false,
    "mega": false,
    "shiny": false,
    "special_tags": null,
    "art_style": null,
    "health": 90,
    "retreat": 3,
    "weakness": "Fire",
    "ability": {
      "exists": false,
      "name": null,
      "effect": null
    },
    "card_text": null,
    "attacks": {
      "1": {
        "cost": "G",
        "name": "Sweets Relay",
        "damage": 40,
        "effect": "If 1 of your Pokémon used Sweets Relay during your last turn, this attack does 30 more damage."
      },
      "2": {
        "cost": null,
        "name": null,
        "damage": null,
        "effect": null
      }
    },
    "points": 1,
    "tradable": true,
    "sharable": true,
    "trade_cost": 0,
    "deckBuilderNr": 803,
    "artist": "Akira Komayama",
    "flavour_text": "It feeds mainly on sweet apples. It will also eat small bug Pokémon that are attracted by its sweet nectar.",
    "alternate_versions": []
  },
  {
    "id": "a3b-008",
    "name": "Flareon",
    "set_code": "a3b",
    "set_name": "Eevee Grove",
    "pack": "Eevee Grove",
    "release_date": "2025-06-26",
    "type": "Pokémon",
    "subtype": "Fire",
    "stage": "Stage 1",
    "evolves_from": "Eevee",
    "rarity": "◊◊◊",
    "pack_points": 150,
    "ex": false,
    "mega": false,
    "shiny": false,
    "special_tags": null,
    "art_style": null,
    "health": 110,
    "retreat": 2,
    "weakness": "Water",
    "ability": {
      "exists": false,
      "name": null,
      "effect": null
    },
    "card_text": null,
    "attacks": {
      "1": {
        "cost": "RC",
        "name": "Assisting Heater",
        "damage": 40,
        "effect": "Take a [R] Energy from your Energy Zone and attach it to 1 of your Benched Pokémon."
      },
      "2": {
        "cost": null,
        "name": null,
        "damage": null,
        "effect": null
      }
    },
    "points": 1,
    "tradable": true,
    "sharable": true,
    "trade_cost": 1200,
    "deckBuilderNr": 804,
    "artist": "Eri Yamaki",
    "flavour_text": "Inhaled air is carried to its flame sac, heated, and exhaled as fire that reaches over 3,000 degrees Fahrenheit.",
    "alternate_versions": [
      {
        "set_code": "a3b",
        "set_name": "Eevee Grove",
        "id": 71,
        "rarity": "☆"
      },
      {
        "set_code": "a4",
        "set_name": "Wisdom of Sea and Sky",
        "id": 213,
        "rarity": "☆"
      },
      {
        "set_code": "a4b",
        "set_name": "Deluxe Pack: ex",